id,date,attending,name,img,club_id
1198336.0,2019-01-25,224,"Meat Free with UVB, Scalameriya (Live), Dr. Joseph & More",2019/1/uk-0125-1198336-list.jpg,112509.0
1209232.0,2019-01-24,60,Call In Sick w: Croatian Amor and Croww,2019/1/uk-0124-1209232-list.jpg,112509.0
1197854.0,2019-01-18,106,"Pretty Pretty Good x B.L.O.O.M.: Karen Gwyer (Live), Object Blue (Live), Danielle",2019/1/uk-0118-1197854-list.jpg,112509.0
1349055.0,2019-12-31,48,Finn presents: NYE 2019,2019/12/uk-1231-1349055-list.jpg,14042.0
1359879.0,2019-12-21,1,Swing Ting 11th Birthday - Last Monthly Session,2019/12/uk-1221-1359879-list.jpg,14042.0
1353655.0,2019-12-20,1,WAX: Last Funk Before Christmas,2019/12/uk-1220-1353655-list.jpg,14042.0
1356722.0,2019-12-14,2,Soup Kitchen's Christmas Do,2019/12/uk-1214-1356722-list.jpg,14042.0
1344574.0,2019-12-13,6,Soup Kitchen presents: DJ Lyster,2019/12/uk-1213-1344574-list.jpg,14042.0
1306363.0,2019-12-12,7,Transmission Funk presents Byron The Aquarius [All Night Long],dj/byrontheaquarius-list.jpg,14042.0
1345854.0,2019-12-07,87,Kiss Me Again #36,2019/12/uk-1207-1345854-list.jpg,14042.0
1343784.0,2019-12-06,50,B.L.O.O.M. presents: Angel D'lite,2019/12/uk-1206-1343784-list.jpg,14042.0
1342393.0,2019-12-05,75,Digitalism presents: Lone,2019/12/uk-1205-1342393-list.jpg,14042.0
1335956.0,2019-11-30,53,Banana Hill with Worm Disco Club,2019/11/uk-1130-1335956-list.jpg,14042.0
1334149.0,2019-11-29,24,Manara b2b Asmara / Strange Riddims,2019/11/uk-1129-1334149-list.jpg,14042.0
1336919.0,2019-11-23,4,Artificial Intelligence with Visionobi - 'The Series' Tour MCR,2019/11/uk-1123-1336919-list.jpg,14042.0
1328288.0,2019-11-22,96,Red Bull & Dimensions present Get Down Early - Manchester,2019/11/uk-1122-1328288-list.jpg,14042.0
1345736.0,2019-11-16,1,"Swing Ting featuring Tarzsa, Fox & Residents",2019/11/uk-1116-1345736-list.jpg,14042.0
1344748.0,2019-11-15,0,Spin Class with Danuka and George Ordish,2019/11/uk-1115-1344748-list.jpg,14042.0
1339860.0,2019-11-09,4,Oh141: Manchester Edition*,2019/11/uk-1109-1339860-list.jpg,14042.0
1334553.0,2019-11-08,18,Tama Sumo (All Night Long),2019/11/uk-1108-1334553-list.jpg,14042.0
1306357.0,2019-11-07,48,Transmission Funk with Bellaire,dj/bellaire-list.jpg,14042.0
1336055.0,2019-11-02,52,Kiss Me Again #35 w/ Hesska & Clemency,2019/11/uk-1102-1336055-list.jpg,14042.0
1305182.0,2019-11-01,2,Ishmael Ensemble (Live),dj/ishmael-uk-list.jpg,14042.0
1335255.0,2019-11-01,0,Trax Haven presents: Samurai Breaks,2019/11/uk-1101-1335255-list.jpg,14042.0
1331613.0,2019-10-31,3,Freedom Of Movement: A Brexit Bash,2019/10/uk-1031-1331613-list.jpg,14042.0
1331492.0,2019-10-30,15,Brexcxit: A Pre-Brexit Pop Party,2019/10/uk-1030-1331492-list.jpg,14042.0
1328116.0,2019-10-26,5,Dualpower MCR,2019/10/uk-1026-1328116-list.jpg,14042.0
1329365.0,2019-10-25,3,Mutualism x Soup Kitchen present: Akash plugkeisha,2019/10/uk-1025-1329365-list.jpg,14042.0
1318685.0,2019-10-24,113,Off Beat: Holding Hands Takeover [All Night Long],2019/10/uk-1024-1318685-list.jpg,14042.0
1332606.0,2019-10-19,2,Swing Ting: Fox - Juice Flow Album Launch,2019/10/uk-1019-1332606-list.jpg,14042.0
1326883.0,2019-10-18,9,Banana Hill with Cervo & JVC,2019/10/uk-1018-1326883-list.jpg,14042.0
1311773.0,2019-10-17,15,"Klub Kiwi - Conducta, Sharda, Mind of a Dragon",2019/10/uk-1017-1311773-list.jpg,14042.0
1296730.0,2019-10-12,168,"Pretty Pretty Good: Roman Flügel, Alienata, Wow & Flutter",2019/10/uk-1012-1296730-list.jpg,14042.0
1303683.0,2019-10-11,116,"Goodness: Umfang, Luca Lozano",2019/10/uk-1011-1303683-list.jpg,14042.0
1320972.0,2019-10-10,4,Lunar 1st Birthday w/ Source Direct (METALHEADZ),2019/10/uk-1010-1320972-list.jpg,14042.0
1300718.0,2019-10-06,9,Daedelus (Live),dj/daedelus-list.jpg,14042.0
1316778.0,2019-10-05,1,Kiss Me Again,2019/10/uk-1005-1316778-list.jpg,14042.0
1317111.0,2019-10-04,14,Cong Burn x Idle Hands: Chris Farrell / Andy Mac / Howes / Lack,dj/chrisfarrell-list.jpg,14042.0
1306354.0,2019-10-03,18,Transmission Funk presents CC:DISCO! [All Night Long],2019/10/uk-1003-1306354-list.jpg,14042.0
1317934.0,2019-09-28,10,"Body To Move with Pearlhead, Contours & Cervo",2019/9/uk-0928-1317934-list.jpg,14042.0
1312524.0,2019-09-27,9,"Soup Kitchen presents: Dance System, Henzo & Sonice",2019/9/uk-0927-1312524-list.jpg,14042.0
1315082.0,2019-09-26,5,Club Djembe MCR: Jossy Mitsu,2019/9/uk-0926-1315082-list.jpg,14042.0
1308214.0,2019-09-21,2,Hannah Diamond (Live),2019/9/uk-0921-1308214-list.jpg,14042.0
1318066.0,2019-09-20,0,Strange Riddims present: Jessica & Arma,2019/9/uk-0920-1318066-list.jpg,14042.0
1305020.0,2019-09-19,26,Transmission Funk presents Shanti Celeste [All Night Long],2019/9/uk-0919-1305020-list.jpg,14042.0
1304831.0,2019-09-18,3,"Left, Right & Centre → Spooky, Patrice + DJ Luz",dj/spooky-list.jpg,14042.0
1308052.0,2019-09-13,75,Cosmic Slop Manchester,2019/9/uk-0913-1308052-list.gif,14042.0
1297264.0,2019-09-13,2,Bunny Hoova Live,dj/bunny-2-list.jpg,14042.0
1304460.0,2019-09-07,12,"Tax Free x Dubuntu with Innsyter, Max Graef, Abdul, Funkycan, Dr Mystery & DJ Gardener",2019/9/uk-0907-1304460-list.jpg,14042.0
1310598.0,2019-09-06,10,Five Years Of Wisdom Teeth,dj/lurka-list.jpg,14042.0
1299879.0,2019-08-31,10,Soup Kitchen's 9th Birthday,dj/hesska-list.jpg,14042.0
1302016.0,2019-08-30,28,"Limbo Radio presents: OK Williams, Dr. Banana & Hanz",2019/8/uk-0830-1302016-list.jpg,14042.0
1291749.0,2019-08-25,3,Kiss Me Again Pride Party! w/ LOFT,2019/8/uk-0825-1291749-list.jpg,14042.0
1301179.0,2019-08-25,1,GFOTY,2019/8/uk-0825-1301179-list.jpg,14042.0
1286226.0,2019-08-24,9,Cong Burn: Rainer Veil / Microdosing / SMS,dj/rainerveil-list.jpg,14042.0
1295232.0,2019-08-23,13,Tama Sumo presents: Cervo & Tama Sumo,dj/tamasumo-list.jpg,14042.0
1304152.0,2019-08-16,4,Transmission Funk x Nova Batida presents Medlar,2019/8/uk-0816-1304152-list.jpg,14042.0
1275261.0,2019-08-14,5,Oval,dj/oval-list.jpg,14042.0
1293150.0,2019-08-09,13,"Finn presents: Chunky, Tom Boogizm, Finn (All Night Long)",2019/8/uk-0809-1293150-list.jpg,14042.0
1292436.0,2019-08-03,15,"Soup Kitchen presents: Silvia Kastel, Sofay, BFTT",2019/8/uk-0803-1292436-list.jpg,14042.0
1282815.0,2019-08-02,39,Zutekh presents Leon Vynehall,2019/8/uk-0802-1282815-list.jpg,14042.0
1278667.0,2019-07-27,107,Joy Orbison / Rahim / Lyster,2019/7/uk-0727-1278667-list.jpg,14042.0
1281012.0,2019-07-26,36,Mean Streets presents ' Nando's Riddim' Ep Launch Party,2019/7/uk-0726-1281012-list.jpg,14042.0
1232088.0,2019-07-21,9,Pye Corner Audio & Faten Kanaan,dj/pyecorneraudio-list.jpg,14042.0
1281578.0,2019-07-20,5,Swing Ting feat. Batu,dj/batu-uk-list.jpg,14042.0
1276344.0,2019-07-19,21,"INTERVENTION with Happa b2b Ifeoluwa, Forever",2019/7/uk-0719-1276344-list.jpg,14042.0
1241490.0,2019-07-18,5,Prison Religion + Iceboy Violet,dj/prisonreligion-list.jpg,14042.0
1257489.0,2019-07-17,0,Sock Free Hideaway presents,2019/7/uk-0717-1257489-list.jpg,14042.0
1283542.0,2019-07-14,3,Le1f Live,dj/le1f-list.jpg,14042.0
1287915.0,2019-07-12,20,"Left, Right & Centre → DJ Lag",dj/djlag-list.jpg,14042.0
1279679.0,2019-07-05,8,Zutekh presents Jay Clarke,2019/7/uk-0705-1279679-list.jpg,14042.0
1282849.0,2019-06-29,1,"Strange Riddims present: Hagan, Tamtam, Down2earth",2019/6/uk-0629-1282849-list.jpg,14042.0
1271339.0,2019-06-28,12,"Soup Kitchen presents: Anthony Naples, Dj'j, Eszaid & Cyrus",2019/6/uk-0628-1271339-list.jpg,14042.0
1265173.0,2019-06-22,24,Banana Hill with DJ Tahira,2019/6/uk-0622-1265173-list.jpg,14042.0
1269861.0,2019-06-21,28,Soup Kitchen Curators: Tama Sumo & Wendel Sield,2019/6/uk-0621-1269861-list.jpg,14042.0
1278904.0,2019-06-15,1,Swing Ting feat. Epic B & Meme Gold,2019/6/uk-0615-1278904-list.jpg,14042.0
1270650.0,2019-06-14,37,Cosmic Slop Manchester,2019/6/uk-0614-1270650-list.jpg,14042.0
1270305.0,2019-06-09,2,Afterlife presents,dj/oflynn-list.jpg,14042.0
1270297.0,2019-06-08,3,AFTERLIFE: ZUTEKH,dj/krysko-list.jpg,14042.0
1257019.0,2019-06-08,1,Yosi Horikawa Live,dj/yosihorikawa-list.jpg,14042.0
1265444.0,2019-06-07,11,"Soup Kitchen presents: Peder Mannerfelt (Live), Ossia, Herron",2019/6/uk-0607-1265444-list.jpg,14042.0
1239634.0,2019-06-05,19,CULT — DJ Python + JDS,2019/6/uk-0605-1239634-list.jpg,14042.0
1249198.0,2019-05-25,25,Ground Club: Fumiya Tanaka,2019/5/uk-0525-1249198-list.jpg,14042.0
1252274.0,2019-05-25,2,Pie Radio: Live,,14042.0
1231120.0,2019-05-24,26,"Machine Woman presents: Cera Khin, Izzy Bolt & Loraine James",2019/5/uk-0524-1231120-list.jpg,14042.0
1241353.0,2019-05-17,15,"Pretty Pretty Good: Resom, Yak, Luce_",2019/5/uk-0517-1241353-list.jpg,14042.0
1233881.0,2019-05-14,5,Ishmael Ensemble Live,dj/ishmael-uk-list.jpg,14042.0
1251839.0,2019-05-10,11,Soup Kitchen presents: Editions Gravats,2019/5/uk-0510-1251839-list.jpg,14042.0
1231016.0,2019-05-04,8,Leafcutter John & Sunda Arc Live,2019/5/uk-0504-1231016-list.jpg,14042.0
1260124.0,2019-05-04,2,Kiss Me Again #30 with Kiernan Laveaux & Father of Two,dj/kiernanlaveaux-list.jpg,14042.0
1249908.0,2019-05-03,10,Zutekh presents Hammer,2019/5/uk-0503-1249908-list.jpg,14042.0
1239633.0,2019-05-01,45,CULT — Sherelle + Phoebe Valentine,2019/5/uk-0501-1239633-list.jpg,14042.0
1217287.0,2019-04-27,105,Banana Hill with Habibi Funk,2019/4/uk-0427-1217287-list.jpg,14042.0
1239502.0,2019-04-26,6,"Finn presents: Object Blue, Perko, Annabel Fraser",2019/4/uk-0426-1239502-list.jpg,14042.0
1236427.0,2019-04-25,6,China White: Cody Currie & Joe Corti [All Night Long],2019/4/uk-0425-1236427-list.jpg,14042.0
1211510.0,2019-04-19,30,Cong Burn: Leif,dj/leif-list.jpg,14042.0
1248145.0,2019-04-18,8,Ground Club: Tom Ellis,2019/4/uk-0418-1248145-list.jpg,14042.0
1237880.0,2019-04-13,31,Cosmic Slop Manchester,2019/4/uk-0414-1237880-list.jpg,14042.0
1239288.0,2019-04-12,15,Lyster presents: Efdemin,2019/4/uk-0412-1239288-list.jpg,14042.0
1235869.0,2019-04-11,700,High Hoops x Alternate Cuts - MCDE (Techno Set),2019/4/uk-0411-1235869-list.jpg,14042.0
1221003.0,2019-04-05,37,Zutekh presents HAAi (All Night Long),2019/4/uk-0405-1221003-list.jpg,14042.0
1239631.0,2019-04-04,18,CULT — Saoirse + Benca b2b J. Derecho,2019/4/uk-0404-1239631-list.jpg,14042.0
1236873.0,2019-04-02,10,Phonix presents: Black Loops,2019/4/uk-0402-1236873-list.jpg,14042.0
1212417.0,2019-03-31,59,Jan Jelinek,2019/3/uk-0331-1212417-list.jpg,14042.0
1243401.0,2019-03-30,10,Notre Dance x Soup Kitchen: Gene on Earth & Tom VR,2019/3/uk-0330-1243401-list.jpg,14042.0
1217285.0,2019-03-29,47,"Banana Hill with Taurtollo, Clay & Cervo",2019/3/uk-0329-1217285-list.jpg,14042.0
1207889.0,2019-03-28,65,Natural Sciences x Miley Serious x Textasy x Character Collapse,2019/3/uk-0328-1207889-list.jpg,14042.0
1223630.0,2019-03-23,21,Soup Kitchen presents: Laurel Halo b2b Hodge,dj/laurelhalo-list.jpg,14042.0
1187919.0,2019-03-22,31,Tama Sumo presents... Lakuti & Tama Sumo All Night Long,2019/3/uk-0322-1187919-list.jpg,14042.0
1216283.0,2019-03-21,43,"Goodness: Zenker Brothers, Phoebe Valentine",2019/3/uk-0321-1216283-list.jpg,14042.0
1187918.0,2019-03-15,20,Afrodeutsche presents... Hexagon Blood (Live/AV) & Afrodeutsche,dj/afrodeutsche-list.jpg,14042.0
1224325.0,2019-03-14,28,Transmission Funk presents O'Flynn [All Night Long],2019/3/uk-0314-1224325-list.jpg,14042.0
1207024.0,2019-03-13,83,CULT 4th Birthday — Pearson Sound + Gwenan,2019/3/uk-0313-1207024-list.jpg,14042.0
1216238.0,2019-03-07,28,Transmission Funk presents Kornél Kovács [All Night Long],2019/3/uk-0307-1216238-list.jpg,14042.0
1213876.0,2019-03-01,15,Zutekh presents E-Numbers with Voigtmann & More,2019/3/uk-0301-1213876-list.jpg,14042.0
1207021.0,2019-02-28,67,CULT — Jensen Interceptor + Jenny Cheng,2019/2/uk-0228-1207021-list.jpg,14042.0
1208533.0,2019-02-27,21,"Acrylic x Riddim Division: Manara b2b A.G, Master Peace, Amy Becker",2019/2/uk-0227-1208533-list.jpg,14042.0
1211324.0,2019-02-26,1,Boy Harsher Kontravoid,dj/boyharsher-list.jpg,14042.0
1201458.0,2019-02-23,93,Soup Kitchen presents: Jane Fitz b2b Carl_h (Animals On Psychedelics),dj/janefitz-list.jpg,14042.0
1217284.0,2019-02-22,29,Banana Hill with Stamp The Wax,2019/2/uk-0222-1217284-list.jpg,14042.0
1210213.0,2019-02-21,43,Rascal x Six Slice present: Desert Sound Colony & Dr Mystery,dj/desertsoundcolony-list.jpg,14042.0
1223138.0,2019-02-16,1,Swing Ting & Florentino present Club Romantico,2019/2/uk-0216-1223138-list.jpg,14042.0
1187916.0,2019-02-15,9,The Trilogy Tapes presents... Will Bankhead / Duster Valentine/ Mother,dj/willbankhead-list.jpg,14042.0
1209700.0,2019-02-14,50,Teletech presents: Umwelt,2019/2/uk-0214-1209700-list.jpg,14042.0
1207001.0,2019-02-13,4,Idiom presents: Banoffee Pies Records (Showcase),2019/2/uk-0213-1207001-list.jpg,14042.0
1187914.0,2019-02-09,12,Machine Woman presents... Gabber Eleganza / Akrobat (Live),2019/2/uk-0209-1187914-list.jpg,14042.0
1213458.0,2019-02-08,1,Chow Down 8th Birthday,2019/2/uk-0208-1213458-list.jpg,14042.0
1204270.0,2019-02-07,50,Transmission Funk presents Eclair Fifi [All Night Long],2019/2/uk-0207-1204270-list.jpg,14042.0
1198193.0,2019-02-06,38,Caro: Tornado Wallace & Guests,2019/2/uk-0206-1198193-list.jpg,14042.0
1207426.0,2019-02-01,17,Zutekh presents Special Request (All Night Long),2019/2/uk-0201-1207426-list.jpg,14042.0
1202937.0,2019-01-31,73,"Left, Right & Centre → Ploy [Hessle Audio] Parris [The Trilogy Tapes]",2019/1/uk-0131-1202937-list.jpg,14042.0
1207019.0,2019-01-30,30,CULT — Josey Rebelle + J. Derecho,2019/1/uk-0130-1207019-list.jpg,14042.0
1151618.0,2019-01-26,21,Banana Hill x Meet Me There,2019/1/uk-0126-1151618-list.jpg,14042.0
1187913.0,2019-01-25,13,Lyster presents... John T Gast (Live) / Ieuke (DJ) / Fumu (Live),dj/lyster-list.jpg,14042.0
1201446.0,2019-01-24,46,Transmission Funk presents Crazy P [All Night Long],2019/1/uk-0124-1201446-list.jpg,14042.0
1209509.0,2019-01-23,14,The Tropical Disco Hustle MCR,2019/1/uk-0123-1209509-list.jpg,14042.0
1209357.0,2019-01-18,1,Strange Riddims - Character Unlocked,2019/1/uk-0118-1209357-list.jpg,14042.0
1322078.0,2019-12-27,31,"The Electric Chair Riot w/ Gerd Janson, Horse Meat Disco + more",2019/12/uk-1227-1322078-list.jpg,81697.0
1315984.0,2019-12-20,46,Haus22 presents Rebekah all Night Long,dj/rebekah-list.jpg,81697.0
1315914.0,2019-12-07,194,Teletech: Tommy Four Seven,dj/tommyfourseven-list.jpg,81697.0
1343309.0,2019-11-30,34,Limbo Live In The Loft,2019/11/uk-1130-1343309-list.jpg,81697.0
1334665.0,2019-11-29,23,Christian Löffler,dj/christianloffler-list.jpg,81697.0
1314083.0,2019-11-22,76,"Hidden with Karenn Live, Volvox and Blasha & Allatt",2019/11/uk-1122-1314083-list.jpg,81697.0
1322074.0,2019-11-21,0,PARTY w/ Special Guest (TBA),2019/11/uk-1121-1322074-list.jpg,81697.0
1342589.0,2019-11-16,0,"Warped: InsideInfo, Ray Keith, Ed:It & more",2019/11/uk-1116-1342589-list.jpg,81697.0
1311471.0,2019-11-15,106,Teletech x Hidden: Len Faki,2019/11/uk-1115-1311471-list.jpg,81697.0
1329366.0,2019-11-14,21,Cirque Du Soul: Manchester // Romare,2019/11/uk-1114-1329366-list.jpg,81697.0
1336108.0,2019-11-09,18,Homobloc Afters - Hidden Afters,2019/11/uk-1109-1336108-list.jpg,81697.0
1324367.0,2019-11-08,34,Hit & Run presents Kahn & Neek (All Night Long) White Peach Records,2019/11/uk-1108-1324367-list.jpg,81697.0
1311878.0,2019-11-01,73,Hidden with Raresh & Margaret Dygas,2019/11/uk-1101-1311878-list.jpg,81697.0
1311875.0,2019-10-25,97,"Hidden with Omar S, Claro Intelecto, Craigie Knowes",2019/10/uk-1025-1311875-list.jpg,81697.0
1302688.0,2019-10-19,54,Hit & Run presents 1985 Manchester,2019/10/uk-1019-1302688-list.jpg,81697.0
1329212.0,2019-10-18,28,Hidden with Moodymann,2019/10/uk-1018-1329212-list.jpg,81697.0
1311874.0,2019-10-11,12,"Hidden with Magic Mountain High, DJ Fettburger, Orpheu The Wizard",2019/10/uk-1011-1311874-list.jpg,81697.0
1313484.0,2019-10-04,37,IDWT with Chaos In The CBD & Jon Sable,2019/10/uk-1004-1313484-list.jpg,81697.0
1310903.0,2019-09-28,4,"Me Gusta presents: DJ Firmeza, DJ Danifox (Príncipe)",2019/9/uk-0928-1310903-list.jpg,81697.0
1311872.0,2019-09-21,10,Hidden with Sadar Bahar,2019/9/uk-0921-1311872-list.jpg,81697.0
1325044.0,2019-09-21,0,"24hr Garage Girls ft Shosh, Lady Ice & Sicaria Sound",2019/9/uk-0921-1325044-list.jpg,81697.0
1281196.0,2019-09-20,158,Teletech presents: O'Flynn - Aletheia Album Tour,2019/9/uk-0920-1281196-list.jpg,81697.0
1294798.0,2019-09-20,14,Derton with Quest (YAY),2019/9/uk-0920-1294798-list.jpg,81697.0
1317442.0,2019-09-19,0,Element Opening Party,2019/9/uk-0919-1317442-list.jpg,81697.0
1304167.0,2019-09-18,34,Phonix & BlackBox present: Marquis Hawkes & Youandewan,2019/9/uk-0918-1304167-list.jpg,81697.0
1281804.0,2019-09-16,52,"HIT & RUN with SpectraSoul, Channel One, Unglued, Ternion Sound & Khiva",2019/9/uk-0916-1281804-list.jpg,81697.0
1315451.0,2019-09-14,4,You&Me's 4th Birthday present Valentino Kanzyani,dj/valentinokanzyani-list.jpg,81697.0
1223068.0,2019-08-25,38,Hidden Courtyard Day & Night Pt 3,2019/8/uk-0825-1223068-list.jpg,81697.0
1249753.0,2019-08-24,17,Homoelectric,2019/8/uk-0824-1249753-list.jpg,81697.0
1289978.0,2019-07-20,10,Zutekh Loft Party with Bradley Zero,dj/bradleyzero-list.jpg,81697.0
1288429.0,2019-07-13,1,All Day Open Air Summer Loft Party - Love Dose Records,2019/7/uk-0713-1288429-list.jpg,81697.0
1282838.0,2019-07-06,3,"Pooku Loft Party with Gescu, Zweizig [LIVE]",dj/gescu-list.jpg,81697.0
1264236.0,2019-06-05,39,"Hit & Run with Mala, Mungo's Hi-Fi, Lenzman More",2019/6/uk-0605-1264236-list.jpg,81697.0
1252022.0,2019-05-31,34,DJ Seinfeld (All Night Long),2019/5/uk-0531-1252022-list.jpg,81697.0
1223064.0,2019-05-26,42,Hidden Courtyard Day & Night Pt 2,2019/5/uk-0526-1223064-list.jpg,81697.0
1248505.0,2019-05-25,4,Homoelectric,2019/5/uk-0525-1248505-list.jpg,81697.0
1252017.0,2019-05-24,31,WHP + Zutekh presents Marcel Dettmann,2019/5/uk-0524-1252017-list.jpg,81697.0
1238619.0,2019-05-18,8,Hidden x Lo-Fi with Detroit In Effect,2019/5/uk-0518-1238619-list.jpg,81697.0
1223058.0,2019-05-05,31,Hidden Courtyard Day & Night Pt 1,2019/5/uk-0505-1223058-list.jpg,81697.0
1232663.0,2019-05-04,159,"Goodness: Pangaea, Mama Snake, Izzy Bolt",2019/5/uk-0504-1232663-list.jpg,81697.0
1231565.0,2019-04-19,8,Hidden x Pooku with Ion Ludwig,2019/4/uk-0419-1231565-list.jpg,81697.0
1238455.0,2019-04-18,34,Love Dose with Baba Stiltz (Studio Barnhus),2019/4/uk-0418-1238455-list.jpg,81697.0
1234247.0,2019-04-05,13,You&me present Archie Hamilton,2019/4/uk-0405-1234247-list.jpg,81697.0
1227049.0,2019-03-30,2,Homoelectric,2019/3/uk-0330-1227049-list.jpg,81697.0
1232098.0,2019-03-29,9,Ossia X Hidden,2019/3/uk-0329-1232098-list.jpg,81697.0
1223707.0,2019-03-23,35,Channels & Variation present: Overmono & re:ni,2019/3/uk-0323-1223707-list.jpg,81697.0
1215677.0,2019-03-22,85,"Cooking with Palms Trax Feat. Sassy J, PLO Man & High Hoops",2019/3/uk-0322-1215677-list.jpg,81697.0
1203838.0,2019-03-22,37,Rhythm Theory: STERAC,dj/rhythmtheory-list.jpg,81697.0
1201976.0,2019-03-21,27,Cirque Du Soul: Manchester // The Road To El Dorado,2019/3/uk-0321-1201976-list.jpg,81697.0
1217516.0,2019-03-16,94,Zutekh presents Midland (All Night Long),2019/3/uk-0316-1217516-list.jpg,81697.0
1231125.0,2019-03-09,32,Hit & Run 12th Birthday with Calibre & SDC,2019/3/uk-0309-1231125-list.jpg,81697.0
1209015.0,2019-03-08,23,Hidden with Todd Terje,2019/3/uk-0308-1209015-list.jpg,81697.0
1213797.0,2019-03-02,61,Interkom 0.3: Clouds,2019/3/uk-0302-1213797-list.jpg,81697.0
1211042.0,2019-03-01,44,Hidden x Lo-Fi with Blawan,2019/3/uk-0301-1211042-list.jpg,81697.0
1210283.0,2019-03-01,17,You&me present Traumer,dj/traumer-list.jpg,81697.0
1212775.0,2019-02-23,181,"Teletech presents: DMX Krew (Live), Radioactive Man and Blasha & Allatt",2019/2/uk-0223-1212775-list.jpg,81697.0
1214119.0,2019-02-22,36,Love Dose Records - Green Room Launch,2019/2/uk-0222-1214119-list.jpg,81697.0
1206475.0,2019-02-16,8,Lovedub. Off Beat x Boom Sound: Mala & Loefah,2019/2/uk-0216-1206475-list.jpg,81697.0
1200135.0,2019-02-15,144,"Pretty Pretty Good x Dimensions Festival: Roman Flügel, Saoirse b2b Willow, Phoebe Valentine",2019/2/uk-0215-1200135-list.jpg,81697.0
1189341.0,2019-02-09,44,You&me with Apollonia,2019/2/uk-0209-1189341-list.jpg,81697.0
1213421.0,2019-02-07,95,Deep Sea Disco: Immersive Manchester Launch,2019/2/uk-0207-1213421-list.jpg,81697.0
1201508.0,2019-02-02,24,Hidden x Pooku with Binh & Onur Ozer,2019/2/uk-0202-1201508-list.jpg,81697.0
1179512.0,2019-01-25,295,"Ossia's 3rd Birthday with Nicolas Lutz, Lena Willikens & Minor Science",2019/1/uk-0125-1179512-list.jpg,81697.0
1354407.0,2019-12-26,2,Mvson presents: Boxing Day,2019/12/uk-1226-1354407-list.jpg,87253.0
1349066.0,2019-12-26,1,Mvson presents: Boxing Day,2019/12/uk-1226-1349066-list.jpg,87253.0
1326448.0,2019-12-06,33,SHY FX [Sold Out],2019/12/uk-1206-1326448-list.jpg,87253.0
1310703.0,2019-11-30,11,Glitterbox X Defected,2019/11/uk-1130-1310703-list.jpg,87253.0
1287341.0,2019-11-15,26,SONNY FODERA - RISE UK TOUR,2019/11/uk-1115-1287341-list.jpg,87253.0
1335579.0,2019-10-25,1,Hot Chip,2019/10/uk-1025-1335579-list.jpg,87253.0
1272201.0,2019-10-12,1,Don't Let Daddy Know UK 2019,2019/10/uk-1012-1272201-list.jpg,87253.0
1281741.0,2019-09-21,10,FISHER,2019/9/uk-0921-1281741-list.jpg,87253.0
1281737.0,2019-09-20,14,FISHER,2019/9/uk-0920-1281737-list.jpg,87253.0
1342599.0,2019-12-28,14,Underground Kollektiv presents...Doorly,2019/12/uk-1228-1342599-list.jpg,123363.0
1364813.0,2019-12-20,0,Weedot Presnts. Mixing Mates - Mixcast Fleaucolor,2019/12/uk-1220-1364813-list.jpg,123363.0
1344002.0,2019-12-14,3,Turnout,2019/12/uk-1214-1344002-list.jpg,123363.0
1356046.0,2019-12-13,0,MacLo - All Night Long,2019/12/uk-1213-1356046-list.jpg,123363.0
1351073.0,2019-12-07,1,The Saturday Social with Butane,2019/12/uk-1207-1351073-list.jpg,123363.0
1349958.0,2019-12-05,54,"Bite Back & Method: Alec Falconer, Harry Wills, Rob Amboule (All Night Long)",2019/12/uk-1205-1349958-list.jpg,123363.0
1342371.0,2019-11-30,2,Mödum presents Herck [ro],dj/herck-list.jpg,123363.0
1351091.0,2019-11-29,3,Upcloseandpersonalmcr Techno,,123363.0
1339200.0,2019-11-16,1,Haptik UK,dj/frankee-list.jpg,123363.0
1298156.0,2019-11-15,43,Nite School with Skatebård,2019/11/uk-1115-1298156-list.jpg,123363.0
1340719.0,2019-11-14,32,Bite Back presents: Enchanted Rhythms [WAYS / REEF],dj/enchantedrhythms-list.jpg,123363.0
1298503.0,2019-11-08,16,Dub Explorations presents Conforce,2019/11/uk-1108-1298503-list.jpg,123363.0
1333937.0,2019-10-19,0,Cut the Rug Presents Jake Flory and Nolga,2019/10/uk-1019-1333937-list.jpg,123363.0
1327485.0,2019-10-17,46,Bite Back presents: Mariiin & Sonice,2019/10/uk-1017-1327485-list.jpg,123363.0
1322056.0,2019-10-12,0,Turnout 2nd Birthday w/ Frazer Campbell & Robert James,2019/10/uk-1012-1322056-list.jpg,123363.0
1293417.0,2019-09-20,14,Nite School with Brassica [Feel My Bicep],2019/9/uk-0920-1293417-list.jpg,123363.0
1304222.0,2019-09-19,129,Bite Back presents: Lukas Wigflex & Adam Curtain,2019/9/uk-0919-1304222-list.jpg,123363.0
1278925.0,2019-09-13,20,One Night MCR presents: Rene Wise / Decoy&pex / Weedot,2019/9/uk-0913-1278925-list.jpg,123363.0
1307365.0,2019-09-07,5,The Saturday Social with Burnski,2019/9/uk-0907-1307365-list.jpg,123363.0
1296019.0,2019-08-30,3,Mixing Mates with Carlton Doom & DJ Fart in the Club,dj/carltondoom-list.jpg,123363.0
1296231.0,2019-08-03,2,The Social 3rd Birthday with Mr. C,2019/8/uk-0803-1296231-list.jpg,123363.0
1276194.0,2019-08-02,8,Mödum presents: Mihai Pol - Opening Party,2019/8/uk-0802-1276194-list.jpg,123363.0
1292075.0,2019-07-26,1,Spill The Beans,2019/7/uk-0726-1292075-list.jpg,123363.0
1290273.0,2019-07-12,2,Jerk It with Friends,2019/7/uk-0712-1290273-list.jpg,123363.0
1276412.0,2019-07-06,3,The Saturday Social with VONDA7,2019/7/uk-0706-1276412-list.jpg,123363.0
1262663.0,2019-06-28,4,Mixing Mates with Blasha & Allatt [All Night Long],dj/blashaallatt-list.jpg,123363.0
1240262.0,2019-05-17,8,Nite School with Borrowed Identity [Let's Play House],2019/5/uk-0517-1240262-list.jpg,123363.0
1255363.0,2019-05-16,1,"Haptik Presents Transcode, Luca De-Santo, Hutchings",2019/5/uk-0516-1255363-list.jpg,123363.0
1261935.0,2019-05-09,1,Standalone Residents Abroad - Manchester,dj/laughingman-list.jpg,123363.0
1235772.0,2019-05-04,3,The Saturday Social with Clive Henry,2019/5/uk-0504-1235772-list.jpg,123363.0
1246472.0,2019-05-03,1,Mixing Mates with Marion Hawkes & Aalice,2019/5/uk-0503-1246472-list.jpg,123363.0
1252861.0,2019-05-01,39,Bite Back & Friends,2019/5/uk-0501-1252861-list.jpg,123363.0
1241795.0,2019-04-25,51,Pulse Width w/ Volruptus (live),2019/4/uk-0425-1241795-list.jpg,123363.0
1238637.0,2019-04-18,27,Love Dose with Cottam (Aus Music),2019/4/uk-0418-1238637-list.jpg,123363.0
1241867.0,2019-04-13,1,The Get Down Guys present.. 'All Fired Up',dj/tippa-list.jpg,123363.0
1241455.0,2019-04-12,6,Sounds of Detroit [02]: Charity Fundraiser W/ Special Guests,2019/4/uk-0412-1241455-list.jpg,123363.0
1243457.0,2019-04-11,35,Depth: The Spring Dance with Samuel Padden,dj/samuelpadden-list.jpg,123363.0
1235765.0,2019-04-06,5,The Saturday Social with Alisha,2019/4/uk-0406-1235765-list.jpg,123363.0
1239224.0,2019-04-04,1,Area 808 presents: A Planet Called 808,2019/4/uk-0404-1239224-list.jpg,123363.0
1206948.0,2019-03-29,13,Blasha & Allatt / Motionen / Yant / CS:AR presented by: One Night MCR Techno Sessions,2019/3/uk-0329-1206948-list.jpg,123363.0
1206166.0,2019-03-16,19,Nite School 1st Birthday with Fold b2b Loods,2019/3/uk-0316-1206166-list.jpg,123363.0
1268602.0,2019-03-09,1,Turnout w Ron Obvious Frenchy,2019/3/uk-0309-1268602-list.jpg,123363.0
1219525.0,2019-03-07,75,Bite Back presents Bobby. [Pleasure Club],2019/3/uk-0307-1219525-list.jpg,123363.0
1197745.0,2019-03-02,2,The Saturday Social with Ronnie Spiteri,2019/3/uk-0302-1197745-list.jpg,123363.0
1206313.0,2019-03-01,3,Mixing Mates with Jordan [All Night Long],2019/3/uk-0301-1206313-list.jpg,123363.0
1199936.0,2019-02-09,4,Turnout with Robert James + Jake Hodgkinson,2019/2/uk-0209-1199936-list.jpg,123363.0
1212390.0,2019-02-09,1,The Get Down Guys present...,2019/2/uk-0209-1212390-list.jpg,123363.0
