id,date,attending,name,img,club_id
1240196.0,2019-06-22,1750,Mayan Warrior (Full Art Car) at The Brooklyn Mirage,2019/6/us-0622-1240196-list.jpg,105938.0
1220085.0,2019-06-16,360,"Dirtybird BBQ - Brooklyn (Claude Vonstroke, Justin Martin, Gene Farris & More)",2019/6/us-0616-1220085-list.jpg,105938.0
1248533.0,2019-06-15,343,Carl Cox presents Pure NY,2019/6/us-0615-1248533-list.jpg,105938.0
1261459.0,2019-06-14,481,Claptone The Masquerade,2019/6/us-0614-1261459-list.jpg,105938.0
1275181.0,2019-06-13,1308,"Morgana [free entry]: Atish, John Tejada Live, Nicone, Patricio",2019/6/us-0613-1275181-list.jpg,105938.0
1233895.0,2019-06-09,2801,All Day I Dream Summer Season Opening,2019/6/us-0609-1233895-list.jpg,105938.0
1216915.0,2019-06-01,183,"Lane 8: TNH Summer Gathering, Brooklyn - Sold Out",2019/6/us-0601-1216915-list.jpg,105938.0
1264191.0,2019-05-26,57,Anjunabeats Brooklyn,2019/5/us-0526-1264191-list.jpg,105938.0
1230208.0,2019-05-25,472,"Nora En Pure presents Purified with Huxley, Mat.Joe & More",2019/5/us-0525-1230208-list.jpg,105938.0
1253790.0,2019-05-24,6,A Night with Bitbird,2019/5/us-0524-1253790-list.jpg,105938.0
1238653.0,2019-05-19,817,"Joseph Capriati Invites: Joseph Capriati, Len Faki, François K",2019/5/us-0519-1238653-list.jpg,105938.0
1267434.0,2019-05-19,2,Joseph Capriati Invites Len Faki,,105938.0
1236727.0,2019-05-18,142,Disclosure (DJ Set),2019/5/us-0518-1236727-list.jpg,105938.0
1265305.0,2019-05-16,946,"Morgana [free entry]: DJ Three, Doc Martin, Forever Jung",2019/5/us-0516-1265305-list.jpg,105938.0
1218786.0,2019-05-11,3569,"Brooklyn Mirage Opening - Cityfox Regenerate: Recondite, Adriatique, &ME b2b Adam Port & More",2019/5/us-0511-1218786-list.jpg,105938.0
1226185.0,2019-05-10,493,Black Coffee - Brooklyn Mirage Opening Event - Sold Out,2019/5/us-0510-1226185-list.jpg,105938.0
1344409.0,2019-12-31,164,"Elsewhere NYE with Neon Indian (DJ Set), Amtrac, Tiki Disco, Sybil Jason and More",2019/12/us-1231-1344409-list.jpg,139960.0
1323502.0,2019-12-28,45,"Le Youth, Option4, Ricky Survive, Miss Sabado",2019/12/us-1228-1323502-list.jpg,139960.0
1341149.0,2019-12-28,14,"Nicky Siano, Musclecars",2019/12/us-1228-1341149-list.jpg,139960.0
1347719.0,2019-12-28,2,"Sazón Department with Sebastian Maria, Magnolia Polaris, Probablyourdaddy and Diego Hauz",2019/12/us-1228-1347719-list.jpg,139960.0
1317856.0,2019-12-27,52,"RAC (DJ Set), Eau Claire & Toucan Sounds",2019/12/us-1227-1317856-list.jpg,139960.0
1344420.0,2019-12-27,5,"Risky Business presents: Roland Clark, Rupert Wall, Chilly Mox and Alex Raouf",2019/12/us-1227-1344420-list.jpg,139960.0
1347717.0,2019-12-27,3,"H<3art Beats with QRTR, Oracle666, Cryostatik",2019/12/us-1227-1347717-list.jpg,139960.0
1315170.0,2019-12-21,95,"Todd Terry, Soul Summit and Rissa Garcia",2019/12/us-1221-1315170-list.jpg,139960.0
1344415.0,2019-12-21,10,"Container, Nick Klein, Chloe Lula and GIA",2019/12/us-1221-1344415-list.jpg,139960.0
1344413.0,2019-12-21,3,"Rendezvous with Usherenko, Arvi and Sosae",2019/12/us-1221-1344413-list.jpg,139960.0
1350525.0,2019-12-20,16,Susanne Bartsch x Dream House Productions present: Kunst,2019/12/us-1220-1350525-list.jpg,139960.0
1344429.0,2019-12-20,5,"Apocalipsis presents: Perra Prom with Lita, Oscar Nñ, Ushka and Riobamba",2019/12/us-1220-1344429-list.jpg,139960.0
1348254.0,2019-12-14,434,Horse Meat Disco - New York Residency,2019/12/us-1214-1348254-list.jpg,139960.0
1355435.0,2019-12-13,64,"PAPI JUICE Vol 51: Freak Papi with Yaeji (DJ Set), UNiiQU3, Manara, DJ Moma and More",2019/12/us-1213-1355435-list.jpg,139960.0
1320355.0,2019-12-13,22,Plaid,2019/12/us-1213-1320355-list.jpg,139960.0
1299774.0,2019-12-11,9,"Don't F*ck with Us, Don't F*ck Without Us: A Happy Hour for Planned Parenthood of NYC",2019/9/us-0917-1299774-list.jpg,139960.0
1328434.0,2019-12-10,22,Craig David presents TS5,2019/12/us-1210-1328434-list.jpg,139960.0
1351012.0,2019-12-10,2,"Ajar: A Free Drum n Bass Night with Illexxandra, Hector Mamajuana, Outtatime and TankTop",2019/12/us-1210-1351012-list.jpg,139960.0
1331422.0,2019-12-07,32,"Kidnap, Rinzen & Alice Iguchi",2019/12/us-1207-1331422-list.jpg,139960.0
1351014.0,2019-12-07,5,"Fomo x Makossa Holiday Party with Tara, TAP.10, Darling Chuck, Shinobi Shaw and Special Guests",2019/12/us-1207-1351014-list.jpg,139960.0
1342421.0,2019-12-07,5,"Perreo Intenso with Rod-A, Ned Nice, Mo Yasin & Taki Chula",2019/12/us-1207-1342421-list.jpg,139960.0
1335254.0,2019-12-06,185,"Walker & Royce, J. Worra, Elosi, Anna Morgan, M.Bootyspoon and Swisha",2019/12/us-1206-1335254-list.jpg,139960.0
1308561.0,2019-11-30,82,"Kompakt Night with Michael Mayer, Rex The Dog and Lily Ray",2019/11/us-1130-1308561-list.jpg,139960.0
1327970.0,2019-11-30,57,Occupy the Disco,2019/11/us-1130-1327970-list.jpg,139960.0
1338063.0,2019-11-30,2,Tropics (DJ Set) and Joseph Russell,2019/11/us-1130-1338063-list.jpg,139960.0
1304318.0,2019-11-29,167,"Elseworld: Juan Atkins, Noncompliant, Relaxer (Live), Lauren Flax and More",2019/11/us-1129-1304318-list.jpg,139960.0
1347827.0,2019-11-27,6,Funster & Day Cart present: FUN Day,2019/11/us-1127-1347827-list.jpg,139960.0
1307452.0,2019-11-23,173,"Bonobo (DJ Set), Durante & Henry Wu",2019/11/us-1123-1307452-list.jpg,139960.0
1310232.0,2019-11-23,109,"박혜진 Park hye jin, Deep Creep & Dreemseed",2019/11/us-1123-1310232-list.jpg,139960.0
1321024.0,2019-11-23,25,Kamaal Williams,2019/11/us-1123-1321024-list.jpg,139960.0
1343102.0,2019-11-22,31,"Chez Damier, L&l&l Record Club & Adam R",2019/11/us-1122-1343102-list.jpg,139960.0
1345798.0,2019-11-22,2,Hu$$le in the House and Waxx present: Ella Hu$$le & Jayda B,2019/11/us-1122-1345798-list.jpg,139960.0
1333458.0,2019-11-21,2,Fantastic Voyage presents: Benny Bridges with Jackal Jyve,2019/11/us-1121-1333458-list.jpg,139960.0
1308558.0,2019-11-16,63,"Classixx (DJ Set), Museum of Love (DJ Set), Nelleke, DJ Minx, Extra Water and Dee Diggs",2019/11/us-1116-1308558-list.jpg,139960.0
1313388.0,2019-11-16,26,"Goldroom (Live), Tim Atlas and Nasaya",2019/11/us-1116-1313388-list.jpg,139960.0
1324699.0,2019-11-15,59,"Eagles & Butterflies, Lauren Ritter and Local Dialect",2019/11/us-1115-1324699-list.jpg,139960.0
1314671.0,2019-11-15,12,"Viceroy, Penguin Prison (DJ Set), Akki and DJ Equal",2019/11/us-1115-1314671-list.jpg,139960.0
1324697.0,2019-11-15,3,"The Assembly: Rework with Ducci, AG and Tone Troy",2019/11/us-1115-1324697-list.jpg,139960.0
1292731.0,2019-11-14,26,"Neon Indian, Sateen",2019/11/us-1114-1292731-list.jpg,139960.0
1321495.0,2019-11-14,5,Lovers and Justin Miller,2019/11/us-1114-1321495-list.jpg,139960.0
1314664.0,2019-11-09,109,"Toro Y Moi (DJ Set), Riobamba, A. Ferraro, A. Woodward and Unscented DJ",2019/11/us-1109-1314664-list.jpg,139960.0
1331409.0,2019-11-09,1,"Fomo with Yukibeb (Soulection), Darling Chuck and TAP.10",2019/11/us-1109-1331409-list.jpg,139960.0
1298686.0,2019-11-09,11,Kllo,2019/11/us-1109-1298686-list.jpg,139960.0
1331414.0,2019-11-09,2,"House of Mess with Perris, Morenxxx, Vjuan Allure and I Hate Marky",2019/11/us-1109-1331414-list.jpg,139960.0
1330080.0,2019-11-08,122,Oscar G - The Birthday Event,2019/11/us-1108-1330080-list.jpg,139960.0
1327413.0,2019-11-08,2,Blackbird Blackbird,2019/11/us-1108-1327413-list.jpg,139960.0
1332801.0,2019-11-07,3,"Groundwire with Omo Igi, Ned Nice, Mr. Tipton, Lethal Trip and Ashley Oakley",2019/11/us-1107-1332801-list.jpg,139960.0
1324709.0,2019-11-02,79,"Kenny Dope, Jay Daniel, The Duchess, Acemoma, Rissa Garcia, Joyce Tang and An Mmmxxi Experience",2019/11/us-1102-1324709-list.jpg,139960.0
1324705.0,2019-11-01,142,"Öona Dahl, Baltra, Francis Inferno Orchestra, Fort Romeau, Evan Michael, Space Jam and Laylit",2019/11/us-1101-1324705-list.jpg,139960.0
1326102.0,2019-10-31,5,Yeasayer (Elsewhere 2 Year Anniversary!),2019/10/us-1031-1326102-list.jpg,139960.0
1332818.0,2019-10-31,3,"Loveless Records with DJ Love, Auntie Starr, zorenLo, Montepiedra and Gooddroid",2019/10/us-1031-1332818-list.jpg,139960.0
1308601.0,2019-10-26,155,"Elsewhere Halloween with Mella Dee, Kyle Hall, Elle Dee, Hannah Wants, Goonroom and Mae Ultra",2019/10/us-1026-1308601-list.jpg,139960.0
1311491.0,2019-10-25,105,Susanne Bartsch's Moma PS1 Halloween Ball After Party: Valley of the Dolls,2019/10/us-1025-1311491-list.jpg,139960.0
1335793.0,2019-10-22,2,Landscape Fall Opening Loft,2019/10/us-1022-1335793-list.jpg,139960.0
1296995.0,2019-10-19,263,"Dusky, Anthony Naples & LISAS",2019/10/us-1019-1296995-list.jpg,139960.0
1325166.0,2019-10-19,13,"Let's Play House x Samo Nights with Renata do Valle, Jacques Renault",2019/10/us-1019-1325166-list.jpg,139960.0
1316036.0,2019-10-19,5,"Toucan Sounds with Luka Tacon, Haruka Salt and Violet Sands (DJ Set)",2019/10/us-1019-1316036-list.jpg,139960.0
1326164.0,2019-10-18,57,"Papi Juice Vol. 50: Papi Dreams with Mexican Jihad, Total Freedom, TYGAPAW, Hu Dat and More",2019/10/us-1018-1326164-list.jpg,139960.0
1252196.0,2019-10-17,15,Lust For Youth,2019/10/us-1017-1252196-list.jpg,139960.0
1321544.0,2019-10-12,406,Horse Meat Disco - New York Residency,2019/10/us-1012-1321544-list.jpg,139960.0
1304314.0,2019-10-11,281,"Elseworld: Helena Hauff, Minimal Violence (Live), Octonomy (DJ Set) and More",2019/10/us-1011-1304314-list.jpg,139960.0
1289346.0,2019-10-06,111,"Elsewhere Rooftop Closing with DJ Boring, Seb Wildblood and Rissa Garcia",2019/10/us-1006-1289346-list.jpg,139960.0
1292667.0,2019-10-05,120,"Ghostly 20 (Late) with Matthew Dear (DJ), Galcher Lustwerk (DJ), Ciel (DJ) and More",2019/10/us-1005-1292667-list.jpg,139960.0
1292661.0,2019-10-05,70,"Ghostly 20 (Early) with Gold Panda, Shigeto, Beacon and More",2019/10/us-1005-1292661-list.jpg,139960.0
1302580.0,2019-10-05,6,"Fomo with Kampire, Darling Chuck and TAP.10",2019/10/us-1005-1302580-list.jpg,139960.0
1278294.0,2019-10-04,106,"Romare (Live), Roosevelt (DJ), Allie Bell, 10 Years of Wolf Music",2019/10/us-1004-1278294-list.jpg,139960.0
1307461.0,2019-09-29,15,"Corona Electric Beach presents: Tiga, Due Diligence, Vakkuum, QRTR and Alex English",2019/9/us-0929-1307461-list.jpg,139960.0
1297017.0,2019-09-28,244,"Purple Disco Machine, Jacques Renault, Laura Lynn and Session Victim",2019/9/us-0928-1297017-list.jpg,139960.0
1313483.0,2019-09-28,97,The Ritual with Anané & Louie Vega - Rooftop Edition,2019/9/us-0928-1313483-list.jpg,139960.0
1302569.0,2019-09-28,14,Mira Fahrenheit,2019/9/us-0928-1302569-list.jpg,139960.0
1297040.0,2019-09-27,95,"Soul Clap presents: House of Efunk with Underground System (Live), Byron the Aquarius and More",2019/9/us-0927-1297040-list.jpg,139960.0
1317948.0,2019-09-26,7,No_4mat 'City Boy EP' Release Party with Leevisa,2019/9/us-0926-1317948-list.jpg,139960.0
1285245.0,2019-09-22,90,"Detroit Swindle L&l&l Record Club, Marco Weibel and More (Elsewhere Rooftop)",2019/9/us-0922-1285245-list.jpg,139960.0
1277670.0,2019-09-21,324,"Ross From Friends (Live), Perel, Jen Ferrer, Lauren Lo Sung + Day Cart & Wig-Wam",2019/9/us-0921-1277670-list.jpg,139960.0
1302562.0,2019-09-21,53,Soul Summit at Elsewhere Rooftop,2019/9/us-0921-1302562-list.jpg,139960.0
1302536.0,2019-09-21,13,Blanck Mass + Helm,2019/9/us-0921-1302536-list.jpg,139960.0
1285233.0,2019-09-21,1,Dan Demerit,2019/9/us-0921-1285233-list.jpg,139960.0
1275328.0,2019-09-20,131,"Nightmares on Wax (DJ Set), Jubilee, Kfeelz and More",2019/9/us-0920-1275328-list.jpg,139960.0
1308572.0,2019-09-20,6,Apocalipsis presents: Sin Fronteras Benefit Compilation Release Party with Anna Morgan and More,2019/9/us-0920-1308572-list.jpg,139960.0
1311392.0,2019-09-19,3,Better Listen Records: Martín Miguel and Private Panther,2019/9/us-0919-1311392-list.jpg,139960.0
1310929.0,2019-09-18,4,Catching Flies,2019/9/us-0918-1310929-list.jpg,139960.0
1269482.0,2019-09-13,93,"Justin Martin, Justin Strauss (Elsewhere Rooftop)",2019/9/us-0913-1269482-list.jpg,139960.0
1297000.0,2019-09-13,47,"Jlin, K-Hand, Scraaatch",2019/9/us-0913-1297000-list.jpg,139960.0
1297007.0,2019-09-13,33,"Thugfucker, Alexander:Louis and A-Rock",2019/9/us-0913-1297007-list.jpg,139960.0
1302574.0,2019-09-13,2,Truly Summer with Truly Co. DJs and Guest Jack Steele,2019/9/us-0913-1302574-list.jpg,139960.0
1308556.0,2019-09-12,4,"5 of Nov. presents: Dischetto, Skyboxx, Cruz Cruz, DJ Karen",2019/9/us-0912-1308556-list.jpg,139960.0
1308566.0,2019-09-08,24,Tiki Disco (Summer Rooftop Closing Party!),2019/9/us-0908-1308566-list.jpg,139960.0
1291060.0,2019-09-07,105,Laurel Halo B2B Hodge,2019/9/us-0907-1291060-list.jpg,139960.0
1298649.0,2019-09-07,18,"Fomo x Makossa present: Waajeed, Teedra Moses, Darling Chuck, Tara, Shinobi Shaw",2019/9/us-0907-1298649-list.jpg,139960.0
1293787.0,2019-09-07,11,Soulection Radio presents: The Joe Kay Experience (Special 4 Hour Set),2019/9/us-0907-1293787-list.jpg,139960.0
1301448.0,2019-09-07,3,"XCHANGE DISTRICT with Monchan, Mr. Tipton and Sean Sato",2019/9/us-0907-1301448-list.jpg,139960.0
1304309.0,2019-09-06,44,"Elseworld: Ladies of LCD Soundsystem, Nomi Ruiz, Ash Lauryn and More",2019/9/us-0906-1304309-list.jpg,139960.0
1281629.0,2019-09-06,41,"Keys N Krates (DJ Set), Jubilee and Chong the Nomad (DJ Set) (Elsewhere Rooftop)",2019/9/us-0906-1281629-list.jpg,139960.0
1290995.0,2019-09-05,97,Max Cooper (Live A/V),2019/9/us-0905-1290995-list.jpg,139960.0
1308553.0,2019-09-05,1,Sub Let with Adrien Calvet B2B S.Ake,2019/9/us-0905-1308553-list.jpg,139960.0
1302588.0,2019-09-01,441,Horse Meat Disco - New York Residency,2019/9/us-0901-1302588-list.jpg,139960.0
1276663.0,2019-09-01,28,"Kenny Glasgow, No Regular Play (DJ Set) and Connie",2019/9/us-0901-1276663-list.jpg,139960.0
1308702.0,2019-08-31,7,"100% Electronicon with George Clanton, Saint Pepsi Negative Gemini, Surfing, Vaperror, 18 Carat",2019/8/us-0831-1308702-list.jpg,139960.0
1308706.0,2019-08-31,2,"100% Electronicon Afterparty with Skeleton Lipstick (DJ), Skylar Spence (DJ), Negative Gemini",2019/8/us-0831-1308706-list.jpg,139960.0
1251168.0,2019-08-30,113,Paradise Garage Reunion,2019/8/us-0830-1251168-list.jpg,139960.0
1298098.0,2019-08-25,34,Tiki Disco (Elsewhere Rooftop),2019/8/us-0825-1298098-list.jpg,139960.0
1302954.0,2019-08-24,56,"PAPI JUICE Vol. 49: Papi Paradise with Tayhana, Nadine Artois, Dylan Ali and More",2019/8/us-0824-1302954-list.jpg,139960.0
1285241.0,2019-08-24,31,"Holy Ghost! (DJ Set), JKriv, Zephyr Ann and Felipe From BK (Elsewhere Rooftop)",2019/8/us-0824-1285241-list.jpg,139960.0
1284230.0,2019-08-23,293,"Bound X Elements with Rebekah, Silent Servant (Live), Katie Rex, Paul Birken (Live) and More",2019/8/us-0823-1284230-list.jpg,139960.0
1269516.0,2019-08-23,55,"Mija, Bearcat (Elsewhere Rooftop)",2019/8/us-0823-1269516-list.jpg,139960.0
1299422.0,2019-08-18,54,718 Sessions with Danny Krivit on the Rooftop,2019/8/us-0818-1299422-list.jpg,139960.0
1246688.0,2019-08-17,108,"Amtrac, Bryce David and Mira Fahrenheit (Elsewhere Rooftop)",2019/8/us-0817-1246688-list.jpg,139960.0
1295943.0,2019-08-17,81,"Chaos in the CBD, Heidi Lawden, Earth Boys (Live) and More",2019/8/us-0817-1295943-list.jpg,139960.0
1282301.0,2019-08-17,5,"A Mmmxxi Experience: Bachtroy, Von Isaac",2019/8/us-0817-1282301-list.jpg,139960.0
1246673.0,2019-08-16,134,"George Fitzgerald (DJ Set at Elsewhere Rooftop), The Duchess",2019/8/us-0816-1246673-list.jpg,139960.0
1282921.0,2019-08-16,36,"Waze & Odyssey, J. Worra and Cosmo",2019/8/us-0816-1282921-list.jpg,139960.0
1282320.0,2019-08-16,8,"Jamais Vu with Alice Iguchi, Medina, Son of Lee and Serrian",2019/8/us-0816-1282320-list.jpg,139960.0
1241634.0,2019-08-15,1,**Cancelled** UNDERHER,2019/8/us-0815-1241634-list.jpg,139960.0
1279402.0,2019-08-14,120,"Nicola Cruz (DJ Set), Thomas Von Party (Multi Culti Party at Elsewhere Hall)",2019/8/us-0814-1279402-list.jpg,139960.0
1299845.0,2019-08-14,2,Alex Pasternak,2019/8/us-0814-1299845-list.jpg,139960.0
1260924.0,2019-08-10,89,"Classixx (DJ Set at Elsewhere Rooftop), Young Franco, Rissa Garcia and Alejandra Sabillón",2019/8/us-0810-1260924-list.jpg,139960.0
1286999.0,2019-08-10,49,Susanne Bartsch x Dreamhouse Productions present: Kunst,2019/8/us-0810-1286999-list.jpg,139960.0
1260957.0,2019-08-10,23,"Ouri (DJ Set), Lychee and Significant Other B2B Only Child",2019/8/us-0810-1260957-list.jpg,139960.0
1284234.0,2019-08-09,80,Amon Tobin presents: Two Fingers with Doctor Jeep and Tanktop,2019/8/us-0809-1284234-list.jpg,139960.0
1282305.0,2019-08-09,24,Pleasure Jams 3 Year Anniversary ft Fouk,2019/8/us-0809-1282305-list.jpg,139960.0
1291052.0,2019-08-09,4,"B4 Sounds with Ase Manual, Flor2k, Topshelf Tyson, Burner Account",2019/8/us-0809-1291052-list.jpg,139960.0
1298679.0,2019-08-07,3,Savoir Adore (DJ Set),2019/8/us-0807-1298679-list.jpg,139960.0
1246704.0,2019-08-04,83,"AKUMANDRA 'Aire Libre' Brooklyn with Sainte Vie (Live), Lopal (Live), Mateo & Eli",2019/8/us-0804-1246704-list.jpg,139960.0
1292715.0,2019-08-03,7,"Fomo with Darling Chuck, Trackademicks and TAP.10",2019/8/us-0803-1292715-list.jpg,139960.0
1276742.0,2019-08-03,7,Brasil Summerfest: Baile Funk Rooftop Festival Closing Party,2019/8/us-0803-1276742-list.jpg,139960.0
1292620.0,2019-08-03,2,Popgun presents: Spirit Twin Single Release Show with Camp Blood and Rare DM,2019/8/us-0803-1292620-list.jpg,139960.0
1291008.0,2019-08-03,1,"Brunch Bounce presents: Heatwave with Silent Addy, Zeemuffin, The NY Fox, Eauxzown and More",2019/8/us-0803-1291008-list.jpg,139960.0
1285240.0,2019-08-02,69,"R&S presents: In Order To Dance with Lone, Renaat Vandepapeliere and Cry Baby",2019/8/us-0802-1285240-list.jpg,139960.0
1276666.0,2019-08-02,21,"Newtype Rhythms presents: Dis Fig, Aquarian, Sheepshead and Ra Mico",2019/8/us-0802-1276666-list.jpg,139960.0
1292706.0,2019-08-02,2,Free At Last and Topshelf Tyson,2019/8/us-0802-1292706-list.jpg,139960.0
1264477.0,2019-08-01,80,"Chris Malinchak (DJ Set at Elsewhere Rooftop), Playsuit",2019/7/us-0718-1264477-list.jpg,139960.0
1279407.0,2019-07-31,1,Joey Desktop + Special Guests,2019/7/us-0731-1279407-list.jpg,139960.0
1287051.0,2019-07-28,16,Tiki Disco (Elsewhere Rooftop),2019/7/us-0728-1287051-list.jpg,139960.0
1291160.0,2019-07-27,244,Horse Meat Disco - New York Residency,2019/7/us-0727-1291160-list.jpg,139960.0
1246779.0,2019-07-27,62,Soul Summit (Elsewhere Rooftop),2019/7/us-0727-1246779-list.jpg,139960.0
1246664.0,2019-07-26,57,"Le Youth, Tee Lerrone (Elsewhere Rooftop)",2019/7/us-0726-1246664-list.jpg,139960.0
1284228.0,2019-07-26,18,"Juan Power (Juan Maclean DJ Set + Man Power), MANIK and Sybil Jason",2019/7/us-0726-1284228-list.jpg,139960.0
1276675.0,2019-07-26,13,"Apocalipsis presents: Precolumbian B2B estoc, Kelman Duran, Lita and More",2019/7/us-0726-1276675-list.jpg,139960.0
1279409.0,2019-07-26,2,Mo Yasin + Yellowtech,2019/7/us-0726-1279409-list.jpg,139960.0
1279487.0,2019-07-24,15,"Midnight Magic, Jacques Renault (Elsewhere Rooftop)",2019/7/us-0724-1279487-list.jpg,139960.0
1283738.0,2019-07-21,154,Chus & Ceballos (Elsewhere Roof),2019/7/us-0721-1283738-list.jpg,139960.0
1260922.0,2019-07-20,113,"Baauer, Take a Daytrip and Trillnatured",2019/7/us-0720-1260922-list.jpg,139960.0
1270631.0,2019-07-20,42,"Mark Farina, Musclecars",2019/7/us-0720-1270631-list.jpg,139960.0
1292723.0,2019-07-20,3,"Papi Juice BBQ with Oscar Nñ, Adam R and Surprise Guests",2019/7/us-0720-1292723-list.jpg,139960.0
1279404.0,2019-07-20,2,Active: Y3lda + Zeemuffin,2019/7/us-0720-1279404-list.jpg,139960.0
1264061.0,2019-07-19,44,"Awesome Tapes From Africa, Tune Day, Toribio, Barbie Bertisch and Felipe From BK",2019/7/us-0719-1264061-list.jpg,139960.0
1257846.0,2019-07-19,43,"JackLNDN (DJ Set at Elsewhere Rooftop), Prince Language",2019/7/us-0719-1257846-list.jpg,139960.0
1286994.0,2019-07-19,4,"Risky Business presents: Ant Larock, David Paglia B2B Robbie Lumpkin, Chilly Mox and Alex Raouf",2019/7/us-0719-1286994-list.jpg,139960.0
1285237.0,2019-07-16,2,Josh Kolenik (Small Black) DJ Set,2019/7/us-0716-1285237-list.jpg,139960.0
1279413.0,2019-07-13,91,Boris (Elsewhere Rooftop),2019/7/us-0713-1279413-list.jpg,139960.0
1277046.0,2019-07-13,27,"Metro Area, Olive T, Cromie & Sage Caswell",2019/7/us-0713-1277046-list.jpg,139960.0
1282311.0,2019-07-13,4,"Detour & Co. with Davis Galvin, Alex Price",2019/7/us-0713-1282311-list.jpg,139960.0
1257316.0,2019-07-12,37,"Autograf, LP Giobbi and Akki",2019/7/us-0712-1257316-list.jpg,139960.0
1246799.0,2019-07-12,27,"Earth Beat with Jex Opolis (Live), Heat-Wave, Masha and More",2019/7/us-0712-1246799-list.jpg,139960.0
1257845.0,2019-07-12,8,"Girl Unit, Jadalareign and Elosi",2019/7/us-0712-1257845-list.jpg,139960.0
1282316.0,2019-07-12,4,"Earth Beat Afterparty with Masha, Heat-Wave, Babilonia, Earth Beat Residents: Greg D, Fundido a",2019/7/us-0712-1282316-list.jpg,139960.0
1263535.0,2019-07-06,80,"Pig&Dan (Live), Tiefschwarz and Maŕa",2019/7/us-0706-1263535-list.jpg,139960.0
1277049.0,2019-07-06,75,"Moon Boots, DJ Bruce, Day Cart and Wig-Wam and More",2019/7/us-0706-1277049-list.jpg,139960.0
1278901.0,2019-07-06,9,"Fomo with Bibingka Mama, Darling Chuck, TAP.10 and TIN",2019/7/us-0706-1278901-list.jpg,139960.0
1273916.0,2019-07-06,1,"Rendezvous with Brian Dario, CGC and Eddie Benitez",2019/7/us-0706-1273916-list.jpg,139960.0
1263561.0,2019-07-05,39,"Kelly Lee Owens (DJ Set), Lauren Flax and Heathered Pearls",2019/7/us-0705-1263561-list.jpg,139960.0
1277695.0,2019-07-05,5,"Half Moon with Jessicunt, DJ Swisha, DJ Nativesun and Equiss",2019/7/us-0705-1277695-list.jpg,139960.0
1277086.0,2019-07-05,2,"Foreverware presents: Ren G, Lilei and Despina",2019/7/us-0705-1277086-list.jpg,139960.0
1246774.0,2019-07-04,92,"Elsewhere 4th of July (Rooftop) with JD Samson, Photay (DJ Set) and More",2019/7/us-0704-1246774-list.jpg,139960.0
1268547.0,2019-06-30,34,Tiki Disco (Elsewhere Rooftop),2019/6/us-0630-1268547-list.jpg,139960.0
1215956.0,2019-06-29,215,Wrecked & Carry Nation Present an Out of this World Pride w/ Alinka & Shaun J Wright & More,2019/6/us-0629-1215956-list.jpg,139960.0
1264547.0,2019-06-28,58,PAPI JUICE Vol. 47: World Pride,2019/6/us-0628-1264547-list.jpg,139960.0
1273903.0,2019-06-27,1,Brooklyn Record Exchange Residency with Spicy Boys,2019/6/us-0627-1273903-list.jpg,139960.0
1270616.0,2019-06-26,1,Alisaloog,2019/6/us-0626-1270616-list.jpg,139960.0
1282978.0,2019-06-26,1,"Basside, Tama Gucci, Flor2k, DRUMMy",2019/6/us-0626-1282978-list.jpg,139960.0
1270618.0,2019-06-25,2,Exotic House Party with Animal Feelings (Live) and Kristine Barilli (DJ),2019/6/us-0625-1270618-list.jpg,139960.0
1272320.0,2019-06-23,57,718 Sessions Returns to the Elsewhere Rooftop,2019/6/us-0623-1272320-list.jpg,139960.0
1271838.0,2019-06-22,275,Oscar G (Elsewhere Rooftop),2019/6/us-0622-1271838-list.jpg,139960.0
1277051.0,2019-06-22,7,"Undisclosed Showcase with David Paglia, Karlos Leon, Juan Jimenez and Mark Dumitrescu",2019/6/us-0622-1277051-list.jpg,139960.0
1273466.0,2019-06-22,6,"Penguin Prison (DJ Set), Gigamesh and Blu Detiger",2019/6/us-0622-1273466-list.jpg,139960.0
1264073.0,2019-06-22,3,"Rollover DJs, Higgins",2019/7/us-0722-1264073-list.jpg,139960.0
1246721.0,2019-06-21,96,"Virginia, Project Pablo and Jordan Ehr (Elsewhere Rooftop)",2019/6/us-0621-1246721-list.jpg,139960.0
1264544.0,2019-06-21,17,"NAAFI with Zutzut, Fausto Bahía, Debit, Daniela Lalita and DJ Guapo",2019/6/us-0621-1264544-list.jpg,139960.0
1257841.0,2019-06-21,15,"Stones Throw Night Wtih J Rocc, Peanut Butter Wolf and Ella Hu$$le",2019/6/us-0621-1257841-list.jpg,139960.0
1270625.0,2019-06-21,2,Go Kiryu and Sean Sato,2019/6/us-0621-1270625-list.jpg,139960.0
1273899.0,2019-06-20,1,Brooklyn Record Exchange Residency with Lauren Goulet and Ben Steidel,2019/6/us-0620-1273899-list.jpg,139960.0
1267152.0,2019-06-19,2,Human Pitch,2019/6/us-0619-1267152-list.jpg,139960.0
1279864.0,2019-06-19,1,B3B Oscar Nñ Riobamba Ushka,2019/6/us-0619-1279864-list.jpg,139960.0
1270641.0,2019-06-18,1,Nasty Nigel,2019/6/us-0618-1270641-list.jpg,139960.0
1276113.0,2019-06-18,1,AJ Tracey,2019/6/us-0618-1276113-list.jpg,139960.0
1227314.0,2019-06-15,102,"The Magician, Aston Shuffle, Zephyr Ann, The Golden Pony, Alexander:Louis and More",2019/6/us-0615-1227314-list.jpg,139960.0
1246662.0,2019-06-15,58,"Zimmer (DJ Set at Elsewhere Rooftop), Cry Baby, Evan Michael and Jonny Sum",2019/6/us-0615-1246662-list.jpg,139960.0
1269629.0,2019-06-15,6,Shlohmo,2019/6/us-0615-1269629-list.jpg,139960.0
1268543.0,2019-06-14,93,"Bubble_t Chandelier_by_night with Joey Labeija, Howin Wong and More",2019/6/us-0614-1268543-list.jpg,139960.0
1254999.0,2019-06-14,47,Wonderwheel Recordings & Junxion present: Quantic (DJ) and More Rooftop,2019/6/us-0614-1254999-list.jpg,139960.0
1264064.0,2019-06-14,8,"Muévete Jevi 7.0 with Gooddroid, Lita, Fried Plátano and Gran Reserva",2019/6/us-0614-1264064-list.jpg,139960.0
1275538.0,2019-06-13,40,Susanne Bartsch presents: Club Heartbreak with Mark Ronson and Special Guests,2019/6/us-0613-1275538-list.jpg,139960.0
1273897.0,2019-06-13,3,Brooklyn Record Exchange Residency with DJ Krasdale and Ben Steidel,2019/6/us-0613-1273897-list.jpg,139960.0
1260941.0,2019-06-12,2,Laylit Days with Wake Island and Saphe,2019/6/us-0612-1260941-list.jpg,139960.0
1271836.0,2019-06-09,187,Danny Tenaglia (Elsewhere Rooftop),2019/6/us-0609-1271836-list.jpg,139960.0
1246656.0,2019-06-08,41,"Viceroy, Aric Christopher, Foreign Language, Said the Rabbit and More (Elsewhere Rooftop)",2019/6/us-0608-1246656-list.jpg,139960.0
1254994.0,2019-06-08,24,Uffie (DJ Set) Little Boots (DJ Set) and Sammy Bananas,2019/6/us-0608-1254994-list.jpg,139960.0
1260936.0,2019-06-08,16,"Interstellar Funk, Amourette",2019/6/us-0608-1260936-list.jpg,139960.0
1273532.0,2019-06-08,2,Joy Supply + Rinsed Afterparty with Middle Name Marvel,2019/6/us-0608-1273532-list.jpg,139960.0
1257834.0,2019-06-07,68,"A-Trak, DJ Swisha, Justin Miller and L&l&l",2019/6/us-0607-1257834-list.jpg,139960.0
1246692.0,2019-06-07,15,"TOKiMONSTA presents Young Art Sound II with TOKiMONSTA, Rosehardt and Bad Tuner",dj/tokimonsta-list.jpg,139960.0
1261356.0,2019-06-07,13,"Like That Records with Haram Feat. Aquiles Navarro, Tama Gucci, Equiss, Ase Manual and Marvelit",2019/6/us-0607-1261356-list.jpg,139960.0
